{
  "$schema": "https://json-schema.org/draft/2020-12/schema",
  "$id": "https://kurone-kito.github.io/idd-skill/schemas/idd-roadmap-audit-execute.schema.json",
  "title": "IDD Roadmap Audit Execute",
  "description": "A1.5 roadmap-completion-audit verdict and (under --apply) execution result for a roadmap issue.",
  "type": "object",
  "required": [
    "protocolVersion",
    "decisionAuthority",
    "mode",
    "roadmapNumber",
    "ready",
    "blockers",
    "evidenceBody",
    "closed",
    "claimReleased",
    "result"
  ],
  "properties": {
    "protocolVersion": {
      "type": "string",
      "pattern": "^1$",
      "description": "Protocol version of the A1.5 roadmap-audit verdict."
    },
    "decisionAuthority": {
      "type": "string",
      "enum": ["instructions"],
      "description": "Source of the roadmap completion decision represented by this verdict."
    },
    "mode": {
      "type": "string",
      "enum": ["dry-run", "apply"],
      "description": "Whether the helper produced an audit plan or attempted roadmap mutation."
    },
    "roadmapNumber": {
      "type": "integer",
      "minimum": 1,
      "description": "Roadmap issue evaluated by the completion audit."
    },
    "ready": {
      "type": "boolean",
      "description": "Whether the mechanical roadmap-completion preconditions passed; free-form success criteria still require caller review."
    },
    "blockers": {
      "type": "array",
      "description": "Traversal or readiness conditions that prevent roadmap completion.",
      "items": {
        "type": "object",
        "required": ["kind", "detail"],
        "properties": {
          "kind": {
            "type": "string",
            "enum": [
              "roadmap-closed",
              "roadmap-blocked",
              "childless",
              "open-child",
              "nested-roadmap",
              "open-linked-pr",
              "unresolved-reference",
              "inaccessible-reference",
              "cycle"
            ],
            "description": "Classification of the roadmap completion blocker."
          },
          "target": {
            "type": "integer",
            "minimum": 1,
            "description": "Issue number associated with the blocker, when applicable."
          },
          "provenance": {
            "type": "array",
            "description": "Roadmap and child issue path through which the blocker was discovered.",
            "items": {
              "type": "integer",
              "minimum": 1
            }
          },
          "detail": {
            "type": "string",
            "description": "Evidence or explanation for the blocker."
          }
        },
        "additionalProperties": false
      }
    },
    "evidenceBody": {
      "type": "string",
      "description": "Completion evidence body prepared for the roadmap audit comment."
    },
    "closed": {
      "type": "boolean",
      "description": "Whether the roadmap is closed or known complete; in an idempotent apply retry, true can reflect trusted prior completion without mutation by this invocation."
    },
    "claimReleased": {
      "type": "boolean",
      "description": "Whether apply mode released the roadmap-audit claim."
    },
    "result": {
      "type": "string",
      "description": "Human-readable outcome of the roadmap audit or execution attempt."
    },
    "viewerLoginUnavailable": {
      "type": "boolean",
      "enum": [true],
      "description": "Present (and true) only when the production viewer-login lookup (gh api user) failed for this run; absent when it succeeded."
    },
    "localCoordinationNote": {
      "type": "string",
      "description": "Present only when the local worktree/branch state check (#2225) found something worth a human's attention: a positively broken matched worktree (which also blocks the apply), or a non-blocking informational signal (a present-but-clean matched worktree, an unreadable local git state, or a repo-wide detached worktree). Absent when no local worktree exists for the branch at all."
    },
    "nothingSent": {
      "type": "boolean",
      "description": "Present only when an apply step throws (the evidence comment, the claim re-validation read after it, the close, or the claim release). For a write it describes that write's own request: true when the write provably sent nothing (a load-control refusal, or for a comment post an HTTP 401, 404, or 422 on its first attempt), false when it may have landed. For the claim re-validation read between the evidence comment and the close, which is not a write, it is always false, even for a read that was refused and sent nothing itself, because the run has already sent the evidence comment. Absent on every other verdict."
    }
  },
  "additionalProperties": false
}
